{
  "id": "C4-002",
  "slug": "c4-002-ukraine-siphons-gas-transiting-to-european-customers",
  "cluster": "energy-panic",
  "title_en": "Ukraine siphons gas transiting to European customers",
  "title_uk": "Ukraine siphons gas transiting to European customers",
  "verdict": "false",
  "verdict_date": "2026-09-25",
  "updated": "2026-10-06",
  "languages": [],
  "countries": [],
  "grain_of_truth": false,
  "origin": {
    "first_seen": "2025-11-06",
    "origin_note_en": "Long-running Pravda-network theme aimed at Central European audiences.",
    "network": "pravda",
    "attribution": [
      {
        "org": "Viginum",
        "url": "https://www.sgdsn.gouv.fr/viginum",
        "date": "2024-02-12"
      },
      {
        "org": "NewsGuard",
        "url": "https://www.newsguardtech.com",
        "date": "2025-03-06"
      }
    ]
  },
  "confirmations": [
    {
      "org": "Centre for Countering Disinformation (RNBO)",
      "finding_en": "Independently assessed this narrative as false and published a rebuttal.",
      "date": "2026-09-10",
      "url": "https://cpd.gov.ua"
    },
    {
      "org": "StopFake",
      "finding_en": "Independently assessed this narrative as false and published a rebuttal.",
      "date": "2026-09-01",
      "url": "https://stopfake.org"
    },
    {
      "org": "EUvsDisinfo",
      "finding_en": "Independently assessed this narrative as false and published a rebuttal.",
      "date": "2026-09-07",
      "url": "https://euvsdisinfo.eu"
    }
  ],
  "changelog": [
    {
      "date": "2026-10-06",
      "note_en": "Added partner confirmations."
    },
    {
      "date": "2026-09-25",
      "note_en": "Page published."
    }
  ],
  "related": [
    "C4-001"
  ],
  "demo": true,
  "splice": "D",
  "label": "Ukraine siphons gas transiting to Europe",
  "status": "active",
  "version": "1.0.0",
  "surface_objects": []
}
