{
  "id": "C1-001",
  "slug": "c1-001-zelensky-admitted-that-100-billion-of-us",
  "cluster": "corruption-diverted-aid",
  "title_en": "Zelensky admitted that $100 billion of US aid was stolen",
  "title_uk": "Zelensky admitted that $100 billion of US aid was stolen",
  "verdict": "false",
  "verdict_date": "2026-10-02",
  "updated": "2026-10-24",
  "languages": [
    "de",
    "en",
    "fr",
    "uk"
  ],
  "countries": [
    "at",
    "de",
    "fr",
    "ua",
    "us"
  ],
  "grain_of_truth": true,
  "origin": {
    "first_seen": "2026-03-23",
    "origin_note_en": "A mistranslated excerpt appeared on a Pravda-network node within a day of the interview and was amplified through Telegram before reaching mainstream social platforms.",
    "network": "pravda",
    "attribution": [
      {
        "org": "Viginum",
        "url": "https://www.sgdsn.gouv.fr/viginum",
        "date": "2024-02-12"
      },
      {
        "org": "NewsGuard",
        "url": "https://www.newsguardtech.com",
        "date": "2025-03-06"
      }
    ]
  },
  "confirmations": [
    {
      "org": "VoxCheck",
      "finding_en": "Independently assessed this narrative as false and published a rebuttal.",
      "date": "2026-09-15",
      "url": "https://voxukraine.org/voxcheck"
    },
    {
      "org": "SPRAVDI",
      "finding_en": "Independently assessed this narrative as false and published a rebuttal.",
      "date": "2026-09-28",
      "url": "https://spravdi.org"
    }
  ],
  "changelog": [
    {
      "date": "2026-10-24",
      "note_en": "Added re-measurement results."
    },
    {
      "date": "2026-10-02",
      "note_en": "Page published."
    }
  ],
  "related": [
    "C1-002",
    "C1-003",
    "C1-004"
  ],
  "demo": true,
  "splice": "A",
  "label": "$100bn aid admission",
  "status": "active",
  "version": "1.1.0",
  "debunk_argument": [
    {
      "assertion": "The president admitted that $100 billion of US aid was stolen.",
      "refutation": "He disputed the quoted total, saying Ukraine had received far less than the sum appropriated by Congress and that he could not account for the remainder on the US side.",
      "source": "Reuters, 2025-02-14"
    },
    {
      "assertion": "The missing money went into Ukrainian pockets.",
      "refutation": "Most military aid is spent inside the United States replenishing stockpiles and paying US contractors.",
      "source": "US Department of Defense, 2025-03-02"
    }
  ],
  "surface_objects": [
    {
      "object": "pravda-en.example",
      "type": "outlet",
      "date": "2026-03-23",
      "found_in": "case metadata"
    },
    {
      "object": "rt.com",
      "type": "outlet",
      "date": "2026-03-25",
      "found_in": "case metadata"
    },
    {
      "object": "\"where did the money go\"",
      "type": "marker",
      "date": null,
      "found_in": "case metadata"
    }
  ],
  "false_claim": "Zelensky admitted that $100 billion of US aid was stolen",
  "canonical_debunk": "The interview is real and the president did say he could not account for part of the appropriated money. That is a statement about US budgeting - most military aid is spent inside the United States - not an admission that funds were stolen from Ukraine."
}
