{
  "id": "C2-001",
  "slug": "c2-001-zelenskys-presidential-mandate-expired-in-may-2024",
  "cluster": "delegitimisation",
  "title_en": "Zelensky's presidential mandate expired in May 2024",
  "title_uk": "Zelensky's presidential mandate expired in May 2024",
  "verdict": "misleading",
  "verdict_date": "2026-09-17",
  "updated": "2026-10-24",
  "languages": [],
  "countries": [],
  "grain_of_truth": true,
  "origin": {
    "first_seen": "2026-02-19",
    "origin_note_en": "Pushed heavily across Pravda-network mirrors in the run-up to May 2024 and revived periodically since.",
    "network": "pravda",
    "attribution": [
      {
        "org": "Viginum",
        "url": "https://www.sgdsn.gouv.fr/viginum",
        "date": "2024-02-12"
      },
      {
        "org": "NewsGuard",
        "url": "https://www.newsguardtech.com",
        "date": "2025-03-06"
      }
    ]
  },
  "confirmations": [
    {
      "org": "Centre for Countering Disinformation (RNBO)",
      "finding_en": "Independently assessed this narrative as false and published a rebuttal.",
      "date": "2026-09-08",
      "url": "https://cpd.gov.ua"
    },
    {
      "org": "EUvsDisinfo",
      "finding_en": "Independently assessed this narrative as false and published a rebuttal.",
      "date": "2026-09-03",
      "url": "https://euvsdisinfo.eu"
    },
    {
      "org": "StopFake",
      "finding_en": "Independently assessed this narrative as false and published a rebuttal.",
      "date": "2026-09-02",
      "url": "https://stopfake.org"
    }
  ],
  "changelog": [
    {
      "date": "2026-10-24",
      "note_en": "Added re-measurement results."
    },
    {
      "date": "2026-09-17",
      "note_en": "Page published."
    }
  ],
  "related": [
    "C2-002",
    "C2-003",
    "C2-004"
  ],
  "demo": true,
  "splice": "B",
  "label": "Zelensky's presidential mandate expired ",
  "status": "active",
  "version": "1.0.0",
  "surface_objects": []
}
