{
  "id": "C2-003",
  "slug": "c2-003-zelensky-banned-all-opposition-parties-in-ukraine",
  "cluster": "delegitimisation",
  "title_en": "Zelensky banned all opposition parties in Ukraine",
  "title_uk": "Zelensky banned all opposition parties in Ukraine",
  "verdict": "misleading",
  "verdict_date": "2026-09-21",
  "updated": "2026-10-24",
  "languages": [],
  "countries": [],
  "grain_of_truth": true,
  "origin": {
    "first_seen": "2025-09-09",
    "origin_note_en": "Amplified through Doppelganger clones imitating European legal-affairs coverage.",
    "network": "doppelganger",
    "attribution": [
      {
        "org": "EU DisinfoLab",
        "url": "https://www.disinfo.eu",
        "date": "2022-09-27"
      },
      {
        "org": "DFRLab",
        "url": "https://dfrlab.org",
        "date": "2024-06-18"
      }
    ]
  },
  "confirmations": [
    {
      "org": "EUvsDisinfo",
      "finding_en": "Independently assessed this narrative as false and published a rebuttal.",
      "date": "2026-09-05",
      "url": "https://euvsdisinfo.eu"
    },
    {
      "org": "Centre for Countering Disinformation (RNBO)",
      "finding_en": "Independently assessed this narrative as false and published a rebuttal.",
      "date": "2026-08-28",
      "url": "https://cpd.gov.ua"
    },
    {
      "org": "StopFake",
      "finding_en": "Independently assessed this narrative as false and published a rebuttal.",
      "date": "2026-09-07",
      "url": "https://stopfake.org"
    }
  ],
  "changelog": [
    {
      "date": "2026-10-24",
      "note_en": "Added re-measurement results."
    },
    {
      "date": "2026-09-21",
      "note_en": "Page published."
    }
  ],
  "related": [
    "C2-001",
    "C2-002",
    "C2-004"
  ],
  "demo": true,
  "splice": "C",
  "label": "Zelensky banned all opposition parties i",
  "status": "active",
  "version": "1.0.0",
  "surface_objects": []
}
