{
  "id": "C1-007",
  "slug": "c1-007-billions-of-usaid-funding-for-ukraine-are",
  "cluster": "corruption-diverted-aid",
  "title_en": "Billions of USAID funding for Ukraine are unaccounted for",
  "title_uk": "Billions of USAID funding for Ukraine are unaccounted for",
  "verdict": "misleading",
  "verdict_date": "2026-10-05",
  "updated": "2026-10-24",
  "languages": [
    "de",
    "en",
    "fr",
    "uk"
  ],
  "countries": [
    "at",
    "de",
    "fr",
    "ua",
    "us"
  ],
  "grain_of_truth": true,
  "origin": {
    "first_seen": "2025-09-15",
    "origin_note_en": "Assembled from selectively quoted oversight reports on a laundering site, then amplified across mirrors.",
    "network": "laundering",
    "attribution": [
      {
        "org": "DFRLab",
        "url": "https://dfrlab.org",
        "date": "2025-01-30"
      }
    ]
  },
  "confirmations": [
    {
      "org": "Centre for Countering Disinformation (RNBO)",
      "finding_en": "Independently assessed this narrative as false and published a rebuttal.",
      "date": "2026-10-02",
      "url": "https://cpd.gov.ua"
    },
    {
      "org": "SPRAVDI",
      "finding_en": "Independently assessed this narrative as false and published a rebuttal.",
      "date": "2026-09-15",
      "url": "https://spravdi.org"
    }
  ],
  "changelog": [
    {
      "date": "2026-10-24",
      "note_en": "Added re-measurement results."
    },
    {
      "date": "2026-10-05",
      "note_en": "Page published."
    }
  ],
  "related": [
    "C1-001",
    "C1-002",
    "C1-003"
  ],
  "demo": true,
  "splice": "C",
  "label": "Billions unaccounted for",
  "status": "active",
  "version": "1.1.0",
  "surface_objects": [
    {
      "object": "rt.com",
      "type": "outlet",
      "date": "2026-01-30",
      "found_in": "case metadata"
    },
    {
      "object": "geo-politica.example",
      "type": "outlet",
      "date": "2026-02-02",
      "found_in": "case metadata"
    }
  ]
}
