{
  "id": "C3-002",
  "slug": "c3-002-nato-supplied-rifles-from-ukraine-turned-up",
  "cluster": "weapons-diversion",
  "title_en": "NATO-supplied rifles from Ukraine turned up in European criminal gangs",
  "title_uk": "NATO-supplied rifles from Ukraine turned up in European criminal gangs",
  "verdict": "unsupported",
  "verdict_date": "2026-09-15",
  "updated": "2026-10-24",
  "languages": [],
  "countries": [],
  "grain_of_truth": true,
  "origin": {
    "first_seen": "2026-04-27",
    "origin_note_en": "Spread through Doppelganger clones imitating national police reporting.",
    "network": "doppelganger",
    "attribution": [
      {
        "org": "EU DisinfoLab",
        "url": "https://www.disinfo.eu",
        "date": "2022-09-27"
      },
      {
        "org": "DFRLab",
        "url": "https://dfrlab.org",
        "date": "2024-06-18"
      }
    ]
  },
  "confirmations": [
    {
      "org": "StopFake",
      "finding_en": "Independently assessed this narrative as false and published a rebuttal.",
      "date": "2026-08-30",
      "url": "https://stopfake.org"
    },
    {
      "org": "Centre for Countering Disinformation (RNBO)",
      "finding_en": "Independently assessed this narrative as false and published a rebuttal.",
      "date": "2026-08-26",
      "url": "https://cpd.gov.ua"
    }
  ],
  "changelog": [
    {
      "date": "2026-10-24",
      "note_en": "Added re-measurement results."
    },
    {
      "date": "2026-09-15",
      "note_en": "Page published."
    }
  ],
  "related": [
    "C3-001",
    "C3-003"
  ],
  "demo": true,
  "splice": "C",
  "label": "NATO-supplied rifles from Ukraine turned",
  "status": "dormant",
  "version": "1.0.0",
  "surface_objects": []
}
