{
  "id": "C5-001",
  "slug": "c5-001-ukraine-forcibly-conscripts-men-off-the-street",
  "cluster": "delegitimisation",
  "title_en": "Ukraine forcibly conscripts men off the street with no legal basis",
  "title_uk": "Ukraine forcibly conscripts men off the street with no legal basis",
  "verdict": "misleading",
  "verdict_date": "2026-09-15",
  "updated": "2026-10-24",
  "languages": [],
  "countries": [],
  "grain_of_truth": true,
  "origin": {
    "first_seen": "2026-03-04",
    "origin_note_en": "Amplified by coordinated reply networks using genuine but decontextualised video.",
    "network": "matryoshka",
    "attribution": [
      {
        "org": "CheckFirst",
        "url": "https://checkfirst.network",
        "date": "2024-09-04"
      }
    ]
  },
  "confirmations": [
    {
      "org": "VoxCheck",
      "finding_en": "Independently assessed this narrative as false and published a rebuttal.",
      "date": "2026-08-24",
      "url": "https://voxukraine.org/voxcheck"
    },
    {
      "org": "Centre for Countering Disinformation (RNBO)",
      "finding_en": "Independently assessed this narrative as false and published a rebuttal.",
      "date": "2026-09-10",
      "url": "https://cpd.gov.ua"
    }
  ],
  "changelog": [
    {
      "date": "2026-10-24",
      "note_en": "Added re-measurement results."
    },
    {
      "date": "2026-09-15",
      "note_en": "Page published."
    }
  ],
  "related": [
    "C2-001",
    "C2-002",
    "C2-003"
  ],
  "demo": true,
  "splice": "C",
  "label": "Ukraine forcibly conscripts men off the ",
  "status": "active",
  "version": "1.0.0",
  "surface_objects": []
}
