{
  "id": "C4-001",
  "slug": "c4-001-european-energy-prices-rose-because-of-sanctions",
  "cluster": "energy-panic",
  "title_en": "European energy prices rose because of sanctions, not the invasion",
  "title_uk": "European energy prices rose because of sanctions, not the invasion",
  "verdict": "misleading",
  "verdict_date": "2026-09-17",
  "updated": "2026-09-21",
  "languages": [],
  "countries": [],
  "grain_of_truth": true,
  "origin": {
    "first_seen": "2026-04-26",
    "origin_note_en": "Assembled on a laundering site from selectively quoted market analysis.",
    "network": "laundering",
    "attribution": [
      {
        "org": "DFRLab",
        "url": "https://dfrlab.org",
        "date": "2025-01-30"
      }
    ]
  },
  "confirmations": [
    {
      "org": "VoxCheck",
      "finding_en": "Independently assessed this narrative as false and published a rebuttal.",
      "date": "2026-08-24",
      "url": "https://voxukraine.org/voxcheck"
    },
    {
      "org": "EUvsDisinfo",
      "finding_en": "Independently assessed this narrative as false and published a rebuttal.",
      "date": "2026-09-11",
      "url": "https://euvsdisinfo.eu"
    },
    {
      "org": "Centre for Countering Disinformation (RNBO)",
      "finding_en": "Independently assessed this narrative as false and published a rebuttal.",
      "date": "2026-09-13",
      "url": "https://cpd.gov.ua"
    }
  ],
  "changelog": [
    {
      "date": "2026-09-21",
      "note_en": "Added partner confirmations."
    },
    {
      "date": "2026-09-17",
      "note_en": "Page published."
    }
  ],
  "related": [
    "C4-002"
  ],
  "demo": true,
  "splice": "B",
  "label": "European energy prices rose because of s",
  "status": "active",
  "version": "1.0.0",
  "surface_objects": []
}
