{
  "id": "C3-003",
  "slug": "c3-003-a-significant-share-of-donated-ammunition-never",
  "cluster": "weapons-diversion",
  "title_en": "A significant share of donated ammunition never reaches the front line",
  "title_uk": "A significant share of donated ammunition never reaches the front line",
  "verdict": "unsupported",
  "verdict_date": "2026-10-04",
  "updated": "2026-10-24",
  "languages": [],
  "countries": [],
  "grain_of_truth": true,
  "origin": {
    "first_seen": "2026-01-08",
    "origin_note_en": "Recurring Pravda-network theme in Polish- and English-language mirrors.",
    "network": "pravda",
    "attribution": [
      {
        "org": "Viginum",
        "url": "https://www.sgdsn.gouv.fr/viginum",
        "date": "2024-02-12"
      },
      {
        "org": "NewsGuard",
        "url": "https://www.newsguardtech.com",
        "date": "2025-03-06"
      }
    ]
  },
  "confirmations": [
    {
      "org": "VoxCheck",
      "finding_en": "Independently assessed this narrative as false and published a rebuttal.",
      "date": "2026-09-29",
      "url": "https://voxukraine.org/voxcheck"
    },
    {
      "org": "Centre for Countering Disinformation (RNBO)",
      "finding_en": "Independently assessed this narrative as false and published a rebuttal.",
      "date": "2026-09-15",
      "url": "https://cpd.gov.ua"
    },
    {
      "org": "SPRAVDI",
      "finding_en": "Independently assessed this narrative as false and published a rebuttal.",
      "date": "2026-09-12",
      "url": "https://spravdi.org"
    },
    {
      "org": "StopFake",
      "finding_en": "Independently assessed this narrative as false and published a rebuttal.",
      "date": "2026-09-12",
      "url": "https://stopfake.org"
    }
  ],
  "changelog": [
    {
      "date": "2026-10-24",
      "note_en": "Added re-measurement results."
    },
    {
      "date": "2026-10-04",
      "note_en": "Page published."
    }
  ],
  "related": [
    "C3-001",
    "C3-002"
  ],
  "demo": true,
  "splice": "C",
  "label": "A significant share of donated ammunitio",
  "status": "dormant",
  "version": "1.0.0",
  "surface_objects": []
}
