{
  "id": "C1-004",
  "slug": "c1-004-usaid-paid-celebrities-millions-to-stage-visits",
  "cluster": "corruption-diverted-aid",
  "title_en": "USAID paid celebrities millions to stage visits to Kyiv",
  "title_uk": "USAID paid celebrities millions to stage visits to Kyiv",
  "verdict": "misleading",
  "verdict_date": "2026-09-20",
  "updated": "2026-10-24",
  "languages": [
    "de",
    "en",
    "fr",
    "uk"
  ],
  "countries": [
    "at",
    "de",
    "fr",
    "ua",
    "us"
  ],
  "grain_of_truth": false,
  "origin": {
    "first_seen": "2026-03-09",
    "origin_note_en": "Seeded as a fabricated video, then laundered through low-credibility aggregators before reaching political commentators.",
    "network": "storm-1516",
    "attribution": [
      {
        "org": "Microsoft MTAC",
        "url": "https://www.microsoft.com/mtac",
        "date": "2024-04-17"
      }
    ]
  },
  "confirmations": [
    {
      "org": "StopFake",
      "finding_en": "Independently assessed this narrative as false and published a rebuttal.",
      "date": "2026-09-13",
      "url": "https://stopfake.org"
    },
    {
      "org": "SPRAVDI",
      "finding_en": "Independently assessed this narrative as false and published a rebuttal.",
      "date": "2026-09-13",
      "url": "https://spravdi.org"
    }
  ],
  "changelog": [
    {
      "date": "2026-10-24",
      "note_en": "Added re-measurement results."
    },
    {
      "date": "2026-09-20",
      "note_en": "Page published."
    }
  ],
  "related": [
    "C1-001",
    "C1-002",
    "C1-003"
  ],
  "demo": true,
  "splice": "D",
  "label": "USAID paid celebrities",
  "status": "active",
  "version": "1.1.0",
  "surface_objects": [
    {
      "object": "svoboda-eu.example",
      "type": "outlet",
      "date": "2026-05-02",
      "found_in": "case metadata"
    },
    {
      "object": "matryoshka-hub.example",
      "type": "outlet",
      "date": "2026-05-04",
      "found_in": "case metadata"
    }
  ],
  "false_claim": "USAID paid celebrities millions to stage visits to Kyiv",
  "canonical_debunk": "Public figures did visit Kyiv during the war, several with logistical support from media organisations or NGOs. No evidence connects those visits to US government payments."
}
