{
  "id": "C1-005",
  "slug": "c1-005-zelensky-bought-two-yachts-with-western-aid",
  "cluster": "corruption-diverted-aid",
  "title_en": "Zelensky bought two yachts with Western aid money",
  "title_uk": "Zelensky bought two yachts with Western aid money",
  "verdict": "false",
  "verdict_date": "2026-10-03",
  "updated": "2026-10-15",
  "languages": [
    "de",
    "en",
    "fr",
    "uk"
  ],
  "countries": [
    "at",
    "de",
    "fr",
    "ua",
    "us"
  ],
  "grain_of_truth": false,
  "origin": {
    "first_seen": "2025-09-14",
    "origin_note_en": "Originated on a Pravda-network node with fabricated brokerage documents attached.",
    "network": "pravda",
    "attribution": [
      {
        "org": "Viginum",
        "url": "https://www.sgdsn.gouv.fr/viginum",
        "date": "2024-02-12"
      },
      {
        "org": "NewsGuard",
        "url": "https://www.newsguardtech.com",
        "date": "2025-03-06"
      }
    ]
  },
  "confirmations": [
    {
      "org": "Centre for Countering Disinformation (RNBO)",
      "finding_en": "Independently assessed this narrative as false and published a rebuttal.",
      "date": "2026-09-26",
      "url": "https://cpd.gov.ua"
    },
    {
      "org": "EUvsDisinfo",
      "finding_en": "Independently assessed this narrative as false and published a rebuttal.",
      "date": "2026-09-29",
      "url": "https://euvsdisinfo.eu"
    },
    {
      "org": "StopFake",
      "finding_en": "Independently assessed this narrative as false and published a rebuttal.",
      "date": "2026-09-17",
      "url": "https://stopfake.org"
    },
    {
      "org": "VoxCheck",
      "finding_en": "Independently assessed this narrative as false and published a rebuttal.",
      "date": "2026-09-14",
      "url": "https://voxukraine.org/voxcheck"
    }
  ],
  "changelog": [
    {
      "date": "2026-10-15",
      "note_en": "Added partner confirmations."
    },
    {
      "date": "2026-10-03",
      "note_en": "Page published."
    }
  ],
  "related": [
    "C1-001",
    "C1-002",
    "C1-003"
  ],
  "demo": true,
  "splice": "D",
  "label": "Two yachts",
  "status": "active",
  "version": "1.1.0",
  "surface_objects": [
    {
      "object": "svoboda-eu.example",
      "type": "outlet",
      "date": "2026-02-18",
      "found_in": "case metadata"
    },
    {
      "object": "le-observateur.example",
      "type": "clone",
      "date": "2026-02-21",
      "found_in": "case metadata"
    }
  ]
}
