{
  "id": "C1-002",
  "slug": "c1-002-half-of-us-aid-to-ukraine-was",
  "cluster": "corruption-diverted-aid",
  "title_en": "Half of US aid to Ukraine was funneled back to the Democratic Party through FTX",
  "title_uk": "Half of US aid to Ukraine was funneled back to the Democratic Party through FTX",
  "verdict": "false",
  "verdict_date": "2026-09-18",
  "updated": "2026-10-24",
  "languages": [
    "de",
    "en",
    "fr",
    "uk"
  ],
  "countries": [
    "at",
    "de",
    "fr",
    "ua",
    "us"
  ],
  "grain_of_truth": true,
  "origin": {
    "first_seen": "2026-06-13",
    "origin_note_en": "The claim surfaced on a laundering site presenting itself as independent financial analysis, then spread through US political accounts in late 2022.",
    "network": "laundering",
    "attribution": [
      {
        "org": "DFRLab",
        "url": "https://dfrlab.org",
        "date": "2025-01-30"
      }
    ]
  },
  "confirmations": [
    {
      "org": "Centre for Countering Disinformation (RNBO)",
      "finding_en": "Independently assessed this narrative as false and published a rebuttal.",
      "date": "2026-09-02",
      "url": "https://cpd.gov.ua"
    },
    {
      "org": "EUvsDisinfo",
      "finding_en": "Independently assessed this narrative as false and published a rebuttal.",
      "date": "2026-09-10",
      "url": "https://euvsdisinfo.eu"
    }
  ],
  "changelog": [
    {
      "date": "2026-10-24",
      "note_en": "Added re-measurement results."
    },
    {
      "date": "2026-09-18",
      "note_en": "Page published."
    }
  ],
  "related": [
    "C1-001",
    "C1-003",
    "C1-004"
  ],
  "demo": true,
  "splice": "B",
  "label": "Aid funnelled to a US party",
  "status": "active",
  "version": "1.1.0",
  "surface_objects": [
    {
      "object": "geo-politica.example",
      "type": "outlet",
      "date": "2026-04-11",
      "found_in": "case metadata"
    },
    {
      "object": "news-frontier.example",
      "type": "clone",
      "date": "2026-04-14",
      "found_in": "case metadata"
    }
  ]
}
