{
  "id": "C1-006",
  "slug": "c1-006-ukrainian-officials-hold-14-million-and-foreign",
  "cluster": "corruption-diverted-aid",
  "title_en": "Ukrainian officials hold $14 million and foreign passports abroad",
  "title_uk": "Ukrainian officials hold $14 million and foreign passports abroad",
  "verdict": "unsupported",
  "verdict_date": "2026-09-27",
  "updated": "2026-10-24",
  "languages": [
    "de",
    "en",
    "fr",
    "uk"
  ],
  "countries": [
    "at",
    "de",
    "fr",
    "ua",
    "us"
  ],
  "grain_of_truth": true,
  "origin": {
    "first_seen": "2025-10-09",
    "origin_note_en": "Circulated through a Doppelganger clone imitating a European news brand.",
    "network": "doppelganger",
    "attribution": [
      {
        "org": "EU DisinfoLab",
        "url": "https://www.disinfo.eu",
        "date": "2022-09-27"
      },
      {
        "org": "DFRLab",
        "url": "https://dfrlab.org",
        "date": "2024-06-18"
      }
    ]
  },
  "confirmations": [
    {
      "org": "EUvsDisinfo",
      "finding_en": "Independently assessed this narrative as false and published a rebuttal.",
      "date": "2026-09-14",
      "url": "https://euvsdisinfo.eu"
    },
    {
      "org": "StopFake",
      "finding_en": "Independently assessed this narrative as false and published a rebuttal.",
      "date": "2026-09-09",
      "url": "https://stopfake.org"
    }
  ],
  "changelog": [
    {
      "date": "2026-10-24",
      "note_en": "Added re-measurement results."
    },
    {
      "date": "2026-09-27",
      "note_en": "Page published."
    }
  ],
  "related": [
    "C1-001",
    "C1-002",
    "C1-003"
  ],
  "demo": true,
  "splice": "A",
  "label": "$14m and foreign passports",
  "status": "active",
  "version": "1.1.0",
  "surface_objects": [
    {
      "object": "pravda-en.example",
      "type": "outlet",
      "date": "2026-06-09",
      "found_in": "case metadata"
    },
    {
      "object": "eurasia-review.example",
      "type": "outlet",
      "date": "2026-06-12",
      "found_in": "case metadata"
    }
  ]
}
