{
  "id": "C1-003",
  "slug": "c1-003-ukrainian-officials-stole-100-million-of-western",
  "cluster": "corruption-diverted-aid",
  "title_en": "Ukrainian officials stole $100 million of Western military aid",
  "title_uk": "Ukrainian officials stole $100 million of Western military aid",
  "verdict": "false",
  "verdict_date": "2026-10-01",
  "updated": "2026-10-24",
  "languages": [
    "de",
    "en",
    "fr",
    "uk"
  ],
  "countries": [
    "at",
    "de",
    "fr",
    "ua",
    "us"
  ],
  "grain_of_truth": true,
  "origin": {
    "first_seen": "2026-02-21",
    "origin_note_en": "First observed on a Pravda-network node, then republished across mirrors in four languages within 48 hours.",
    "network": "pravda",
    "attribution": [
      {
        "org": "Viginum",
        "url": "https://www.sgdsn.gouv.fr/viginum",
        "date": "2024-02-12"
      },
      {
        "org": "NewsGuard",
        "url": "https://www.newsguardtech.com",
        "date": "2025-03-06"
      }
    ]
  },
  "confirmations": [
    {
      "org": "SPRAVDI",
      "finding_en": "Independently assessed this narrative as false and published a rebuttal.",
      "date": "2026-09-08",
      "url": "https://spravdi.org"
    },
    {
      "org": "StopFake",
      "finding_en": "Independently assessed this narrative as false and published a rebuttal.",
      "date": "2026-09-08",
      "url": "https://stopfake.org"
    }
  ],
  "changelog": [
    {
      "date": "2026-10-24",
      "note_en": "Added re-measurement results."
    },
    {
      "date": "2026-10-01",
      "note_en": "Page published."
    }
  ],
  "related": [
    "C1-001",
    "C1-002",
    "C1-004"
  ],
  "demo": true,
  "splice": "A",
  "label": "$100m military aid stolen",
  "status": "active",
  "version": "1.1.0",
  "debunk_argument": [
    {
      "assertion": "The $100 million came from Western military aid.",
      "refutation": "It came from contractors paying kickbacks on domestic procurement contracts. No aid instrument financed those contracts.",
      "source": "NABU case materials, 2025-11-10"
    },
    {
      "assertion": "The investigation confirmed the aid link.",
      "refutation": "The published materials name the contracts, the suspects and the mechanism. They do not mention aid.",
      "source": "EUvsDisinfo, 2025-11-28"
    }
  ],
  "surface_objects": [
    {
      "object": "pravda-en.example",
      "type": "outlet",
      "date": "2025-11-12",
      "found_in": "case metadata"
    },
    {
      "object": "pravda-de.example",
      "type": "outlet",
      "date": "2025-11-13",
      "found_in": "case metadata"
    },
    {
      "object": "ukraina-ru.example",
      "type": "outlet",
      "date": "2025-11-13",
      "found_in": "case metadata"
    }
  ]
}
