{
  "id": "C3-001",
  "slug": "c3-001-western-weapons-sent-to-ukraine-are-resold",
  "cluster": "weapons-diversion",
  "title_en": "Western weapons sent to Ukraine are resold on black markets in Africa",
  "title_uk": "Western weapons sent to Ukraine are resold on black markets in Africa",
  "verdict": "unsupported",
  "verdict_date": "2026-09-19",
  "updated": "2026-09-30",
  "languages": [],
  "countries": [],
  "grain_of_truth": true,
  "origin": {
    "first_seen": "2026-06-27",
    "origin_note_en": "Seeded through fabricated interviews attributed to unnamed officials.",
    "network": "storm-1516",
    "attribution": [
      {
        "org": "Microsoft MTAC",
        "url": "https://www.microsoft.com/mtac",
        "date": "2024-04-17"
      }
    ]
  },
  "confirmations": [
    {
      "org": "EUvsDisinfo",
      "finding_en": "Independently assessed this narrative as false and published a rebuttal.",
      "date": "2026-09-14",
      "url": "https://euvsdisinfo.eu"
    },
    {
      "org": "SPRAVDI",
      "finding_en": "Independently assessed this narrative as false and published a rebuttal.",
      "date": "2026-09-05",
      "url": "https://spravdi.org"
    }
  ],
  "changelog": [
    {
      "date": "2026-09-30",
      "note_en": "Added partner confirmations."
    },
    {
      "date": "2026-09-19",
      "note_en": "Page published."
    }
  ],
  "related": [
    "C3-002",
    "C3-003"
  ],
  "demo": true,
  "splice": "C",
  "label": "Western weapons sent to Ukraine are reso",
  "status": "dormant",
  "version": "1.0.0",
  "surface_objects": []
}
