{
  "id": "C2-002",
  "slug": "c2-002-ukraine-cancelled-elections-to-keep-an-unelected",
  "cluster": "delegitimisation",
  "title_en": "Ukraine cancelled elections to keep an unelected leader in power",
  "title_uk": "Ukraine cancelled elections to keep an unelected leader in power",
  "verdict": "misleading",
  "verdict_date": "2026-10-02",
  "updated": "2026-10-24",
  "languages": [],
  "countries": [],
  "grain_of_truth": true,
  "origin": {
    "first_seen": "2026-04-10",
    "origin_note_en": "A recurring Pravda-network theme, localised into each target language.",
    "network": "pravda",
    "attribution": [
      {
        "org": "Viginum",
        "url": "https://www.sgdsn.gouv.fr/viginum",
        "date": "2024-02-12"
      },
      {
        "org": "NewsGuard",
        "url": "https://www.newsguardtech.com",
        "date": "2025-03-06"
      }
    ]
  },
  "confirmations": [
    {
      "org": "SPRAVDI",
      "finding_en": "Independently assessed this narrative as false and published a rebuttal.",
      "date": "2026-09-29",
      "url": "https://spravdi.org"
    },
    {
      "org": "EUvsDisinfo",
      "finding_en": "Independently assessed this narrative as false and published a rebuttal.",
      "date": "2026-09-18",
      "url": "https://euvsdisinfo.eu"
    },
    {
      "org": "Centre for Countering Disinformation (RNBO)",
      "finding_en": "Independently assessed this narrative as false and published a rebuttal.",
      "date": "2026-09-30",
      "url": "https://cpd.gov.ua"
    }
  ],
  "changelog": [
    {
      "date": "2026-10-24",
      "note_en": "Added re-measurement results."
    },
    {
      "date": "2026-10-02",
      "note_en": "Page published."
    }
  ],
  "related": [
    "C2-001",
    "C2-003",
    "C2-004"
  ],
  "demo": true,
  "splice": "A",
  "label": "Ukraine cancelled elections to keep an u",
  "status": "active",
  "version": "1.0.0",
  "surface_objects": []
}
