{
  "id": "C5-002",
  "slug": "c5-002-ukrainian-reconstruction-contracts-were-awarded-to-sh",
  "cluster": "corruption-diverted-aid",
  "title_en": "Ukrainian reconstruction contracts were awarded to shell companies",
  "title_uk": "Ukrainian reconstruction contracts were awarded to shell companies",
  "verdict": "unsupported",
  "verdict_date": "2026-09-27",
  "updated": "2026-10-09",
  "languages": [
    "de",
    "en",
    "fr",
    "uk"
  ],
  "countries": [
    "at",
    "de",
    "fr",
    "ua",
    "us"
  ],
  "grain_of_truth": true,
  "origin": {
    "first_seen": "2026-02-14",
    "origin_note_en": "Circulated through a Doppelganger clone imitating a business-news outlet.",
    "network": "doppelganger",
    "attribution": [
      {
        "org": "EU DisinfoLab",
        "url": "https://www.disinfo.eu",
        "date": "2022-09-27"
      },
      {
        "org": "DFRLab",
        "url": "https://dfrlab.org",
        "date": "2024-06-18"
      }
    ]
  },
  "confirmations": [
    {
      "org": "StopFake",
      "finding_en": "Independently assessed this narrative as false and published a rebuttal.",
      "date": "2026-09-18",
      "url": "https://stopfake.org"
    },
    {
      "org": "Centre for Countering Disinformation (RNBO)",
      "finding_en": "Independently assessed this narrative as false and published a rebuttal.",
      "date": "2026-09-09",
      "url": "https://cpd.gov.ua"
    },
    {
      "org": "SPRAVDI",
      "finding_en": "Independently assessed this narrative as false and published a rebuttal.",
      "date": "2026-09-18",
      "url": "https://spravdi.org"
    }
  ],
  "changelog": [
    {
      "date": "2026-10-09",
      "note_en": "Added partner confirmations."
    },
    {
      "date": "2026-09-27",
      "note_en": "Page published."
    }
  ],
  "related": [
    "C1-001",
    "C1-002",
    "C1-003"
  ],
  "demo": true,
  "splice": "C",
  "label": "Reconstruction shell companies",
  "status": "active",
  "version": "1.1.0",
  "surface_objects": [
    {
      "object": "der-bote.example",
      "type": "clone",
      "date": "2026-07-08",
      "found_in": "case metadata"
    },
    {
      "object": "eurasia-review.example",
      "type": "outlet",
      "date": "2026-07-10",
      "found_in": "case metadata"
    }
  ]
}
