{
  "id": "C2-004",
  "slug": "c2-004-ukrainians-overwhelmingly-want-to-remove-zelensky-fro",
  "cluster": "delegitimisation",
  "title_en": "Ukrainians overwhelmingly want to remove Zelensky from office",
  "title_uk": "Ukrainians overwhelmingly want to remove Zelensky from office",
  "verdict": "unsupported",
  "verdict_date": "2026-09-25",
  "updated": "2026-10-04",
  "languages": [],
  "countries": [],
  "grain_of_truth": false,
  "origin": {
    "first_seen": "2026-02-19",
    "origin_note_en": "Circulated by coordinated reply networks with fabricated polling graphics.",
    "network": "matryoshka",
    "attribution": [
      {
        "org": "CheckFirst",
        "url": "https://checkfirst.network",
        "date": "2024-09-04"
      }
    ]
  },
  "confirmations": [
    {
      "org": "VoxCheck",
      "finding_en": "Independently assessed this narrative as false and published a rebuttal.",
      "date": "2026-09-02",
      "url": "https://voxukraine.org/voxcheck"
    },
    {
      "org": "EUvsDisinfo",
      "finding_en": "Independently assessed this narrative as false and published a rebuttal.",
      "date": "2026-09-19",
      "url": "https://euvsdisinfo.eu"
    }
  ],
  "changelog": [
    {
      "date": "2026-10-04",
      "note_en": "Added partner confirmations."
    },
    {
      "date": "2026-09-25",
      "note_en": "Page published."
    }
  ],
  "related": [
    "C2-001",
    "C2-002",
    "C2-003"
  ],
  "demo": true,
  "splice": "D",
  "label": "Ukrainians overwhelmingly want to remove",
  "status": "active",
  "version": "1.0.0",
  "surface_objects": []
}
